{
  "name": "character-edit",
  "version": "0.1.0",
  "fx_version": "cerulean",
  "author": "Baloony Gaze",
  "description": "Character Edit",
  "games": ["gta5", "rdr3"],
  "client_scripts": ["client/*.js"],
  "server_scripts": ["server/*.js"],
  "files": ["html/**/*"],
  "ui_page": "html/index.html"
}
