{
  "name": "qb-clothing",
  "version": "1.2.0",
  "fx_version": "cerulean",
  "games": ["gta5"],
  "lua54": true,
  "author": "Kakarot",
  "description": "A menu providing players the ability to change their clothing and accessories",
  "shared_scripts": [
    "@qb-core/shared/locale.lua",
    "locales/en.lua",
    "locales/*.lua",
    "config.lua"
  ],
  "client_scripts": [
    "@PolyZone/client.lua",
    "@PolyZone/BoxZone.lua",
    "@PolyZone/ComboZone.lua",
    "client/main.lua"
  ],
  "server_scripts": [
    "@oxmysql/lib/MySQL.lua",
    "server/main.lua"
  ],
  "ui_page": "html/index.html",
  "files": [
    "html/index.html",
    "html/main.js"
  ],
  "dependencies": ["qb-core", "_shared"]
}
