{
  "name": "qb-core",
  "version": "1.3.0",
  "fx_version": "cerulean",
  "games": ["gta5"],
  "lua54": true,
  "author": "Kakarot",
  "description": "Core resource for the framework, contains all the core functionality and features",
  "shared_scripts": [
    "config.lua",
    "shared/locale.lua",
    "locale/en.lua",
    "locale/*.lua",
    "shared/main.lua",
    "shared/items.lua",
    "shared/jobs.lua",
    "shared/vehicles.lua",
    "shared/gangs.lua",
    "shared/weapons.lua",
    "shared/locations.lua"
  ],
  "client_scripts": [
    "client/main.lua",
    "client/functions.lua",
    "client/loops.lua",
    "client/events.lua",
    "client/drawtext.lua"
  ],
  "server_scripts": [
    "@oxmysql/lib/MySQL.lua",
    "server/main.lua",
    "server/functions.lua",
    "server/player.lua",
    "server/events.lua",
    "server/commands.lua",
    "server/exports.lua",
    "server/debug.lua"
  ],
  "ui_page": "html/index.html",
  "files": [
    "html/index.html",
    "html/css/style.css",
    "html/css/drawtext.css",
    "html/js/*.js"
  ],
  "dependencies": ["oxmysql"]
}
