{
  "name": "qb-spawn",
  "version": "1.2.0",
  "fx_version": "cerulean",
  "games": ["gta5"],
  "lua54": true,
  "author": "Kakarot",
  "description": "Allows players to select a spawn point from a list of available locations",
  "shared_scripts": [
    "@qb-core/shared/locale.lua",
    "locales/en.lua",
    "locales/*.lua",
    "config.lua",
    "@qb-apartments/config.lua"
  ],
  "client_scripts": ["client.lua"],
  "server_scripts": [
    "@oxmysql/lib/MySQL.lua",
    "server.lua"
  ],
  "ui_page": "html/index.html",
  "files": [
    "html/index.html",
    "html/style.css",
    "html/vue.js",
    "html/reset.css"
  ]
}
