{
  "name": "qb-multicharacter",
  "version": "1.2.0",
  "fx_version": "cerulean",
  "games": ["gta5"],
  "lua54": true,
  "author": "Kakarot",
  "description": "Allows players to create multiple characters",
  "shared_scripts": [
    "@qb-core/shared/locale.lua",
    "locales/en.lua",
    "locales/*.lua",
    "config.lua"
  ],
  "client_scripts": ["client/main.lua"],
  "server_scripts": [
    "@oxmysql/lib/MySQL.lua",
    "@qb-apartments/config.lua",
    "server/main.lua"
  ],
  "ui_page": "html/index.html",
  "files": [
    "html/index.html",
    "html/main.js",
    "countries.json"
  ],
  "dependencies": ["qb-core", "qb-spawn", "_shared"]
}
