{
  "name": "character-create",
  "version": "0.1.0",
  "fx_version": "cerulean",
  "author": "Baloony Gaze",
  "description": "Character Create",
  "games": ["gta5", "rdr3"],
  "client_scripts": ["client/*.js"],
  "server_scripts": ["server/*.js"],
  "files": ["html/**/*", "translations/*.json"],
  "ui_page": "html/index.html"
}
